{"assessments":[{"assessment":"AFFIRMED","assessmentId":"assessment-artifact-present","basis":"FORMAL_PREDICATE","criterionId":"criterion-artifact-present","evidenceArtifactIds":["reference-deliverable"],"limitations":["Presence establishes neither authorship nor semantic quality."],"predicateStatus":"ESTABLISHED_TRUE","reasonCode":"ARTIFACT_PRESENT","statement":"The deliverable artifact is present and non-empty."},{"assessment":"AFFIRMED","assessmentId":"assessment-artifact-digest","basis":"FORMAL_PREDICATE","criterionId":"criterion-artifact-digest","evidenceArtifactIds":["reference-deliverable"],"limitations":["Digest equality establishes byte identity only."],"predicateStatus":"ESTABLISHED_TRUE","reasonCode":"ARTIFACT_DIGEST_MATCHES","statement":"The observed deliverable digest and size match their signed request commitment."},{"assessment":"AFFIRMED","assessmentId":"assessment-json-schema","basis":"FORMAL_PREDICATE","criterionId":"criterion-json-schema","evidenceArtifactIds":["reference-deliverable","reference-deliverable-schema"],"limitations":["JSON Schema conformance does not establish the deliverable's broader factual accuracy, quality, or commercial fitness."],"predicateStatus":"ESTABLISHED_TRUE","reasonCode":"LOCAL_JSON_SCHEMA_VALID","statement":"The committed deliverable is strict JSON valid against the committed local-only JSON Schema."}],"attestationId":"reference-evaluation-attestation-v0","bindings":{"evidenceBundleDigest":{"algorithm":"sha-256","value":"51da81a2ae2d39ed92a82004205aa9faf4929c0750a9f24df8c04b3e668e0732"},"manifestDigest":{"algorithm":"sha-256","value":"6e6e3c15b1ca8cc85b1148618aeb5c9aa2ba25fac978ebced5fff76c07d7ddf9"},"profileDigest":{"algorithm":"sha-256","value":"61fea8d71334ebe2e41d21a273a04a8bec76931fbe9a95fa017036d0f32dfc49"},"requestDigest":{"algorithm":"sha-256","value":"47f02dd4b3e00bea3537ad554a5cbcece62ad2b37cde6a9c53eb7c8840a6976f"}},"coverage":{"assessedCriterionIds":["criterion-artifact-present","criterion-artifact-digest","criterion-json-schema"],"status":"COMPLETE","unassessedCriterionIds":[]},"economicAction":"OUT_OF_SCOPE","errors":[],"evaluator":{"evaluatorId":"evaldossier-reference-evaluator","keyId":"y9WZZlkOvtQjWU4AR4b9iWnHg7cenc9rVVrN9LI4vNk","softwareVersion":"0.1.0"},"ignoredInputs":[],"issuedAt":"2026-07-21T12:00:02Z","limitations":["The evaluator proves only the predicates named in the signed profile over the committed bytes.","A SATISFIED obligation verdict here is protocol-local and is not an instruction to move funds."],"mode":"NATIVE_EVALUATION","obligationVerdict":"SATISFIED","overallAssessment":{"assessment":"AFFIRMED","basis":"FORMAL_PREDICATE","reasonCode":"ALL_REQUIRED_FORMAL_PREDICATES_TRUE"},"proof":{"jws":"eyJhbGciOiJFZERTQSIsImtpZCI6Ink5V1pabGtPdnRRaldVNEFSNGI5aVduSGc3Y2VuYzlyVlZyTjlMSTR2TmsiLCJ0eXAiOiJldmFsZG9zc2llci5ldmFsdWF0aW9uLWF0dGVzdGF0aW9uLzAuMSJ9..bzZDm9roOxoE3LlqLl-4CVoU5J7oxxzjQWmcEKQzn6-MiaHTrL4eFVqjKe1t5X1IH5Sk01X3yGaPZC3Q_EMGBg","type":"evaldossier.detached-jws/0.1"},"protocolVersion":"evaldossier/0.1","schemaVersion":"evaldossier.evaluation-attestation/0.1","signatureContext":{"audience":"evaldossier-offline-demo","nonce":"reference-attestation-nonce-0001"}}