{"assessments":[{"assessment":"AFFIRMED","assessmentId":"assessment-synthetic-claim-01","basis":"MODEL_JUDGMENT","confidence":{"calibration":"UPSTREAM_REPORTED_UNVERIFIED","scale":"0_TO_1","value":"0.84"},"criterionId":"criterion-synthetic-claim-01","evidenceArtifactIds":["synthetic-model-response","synthetic-model-rubric"],"limitations":["Synthetic claim type: qualitative. Synthetic source note: Synthetic favorable model judgment over a qualitative criterion.","No evidence was supplied. The supported boolean is preserved as a model judgment, not factual proof."],"predicateStatus":"UNDETERMINED","reasonCode":"UPSTREAM_SUPPORTED_TRUE","statement":"The response is clear and relevant to the brief.","upstreamMapping":{"mappingPolicyId":"synthetic-model-judgment-mapping-v0","nativePointer":"/response/claims/0/supported","nativeValue":true,"sourceArtifactId":"synthetic-model-response"}},{"assessment":"AFFIRMED","assessmentId":"assessment-synthetic-claim-02","basis":"MODEL_JUDGMENT","confidence":{"calibration":"UPSTREAM_REPORTED_UNVERIFIED","scale":"0_TO_1","value":"0.71"},"criterionId":"criterion-synthetic-claim-02","evidenceArtifactIds":["synthetic-model-response","synthetic-model-rubric"],"limitations":["Synthetic claim type: factual_quality. Synthetic source note: Synthetic favorable judgment emitted without evidence or formal validation.","No evidence was supplied. The supported boolean is preserved as a model judgment, not factual proof."],"predicateStatus":"UNDETERMINED","reasonCode":"UPSTREAM_SUPPORTED_TRUE","statement":"The response contains no factual errors.","upstreamMapping":{"mappingPolicyId":"synthetic-model-judgment-mapping-v0","nativePointer":"/response/claims/1/supported","nativeValue":true,"sourceArtifactId":"synthetic-model-response"}},{"assessment":"REJECTED","assessmentId":"assessment-synthetic-claim-03","basis":"MODEL_JUDGMENT","confidence":{"calibration":"UPSTREAM_REPORTED_UNVERIFIED","scale":"0_TO_1","value":"0.38"},"criterionId":"criterion-synthetic-claim-03","evidenceArtifactIds":["synthetic-model-response","synthetic-model-rubric"],"limitations":["Synthetic claim type: compliance. Synthetic source note: Synthetic negative judgment over an intentionally underspecified criterion.","No evidence was supplied. The supported boolean is preserved as a model judgment, not factual proof."],"predicateStatus":"UNDETERMINED","reasonCode":"UPSTREAM_SUPPORTED_FALSE","statement":"The response satisfies every unstated buyer preference.","upstreamMapping":{"mappingPolicyId":"synthetic-model-judgment-mapping-v0","nativePointer":"/response/claims/2/supported","nativeValue":false,"sourceArtifactId":"synthetic-model-response"}}],"attestationId":"model-judgment-normalization-attestation-v0","bindings":{"evidenceBundleDigest":{"algorithm":"sha-256","value":"559b3fc415dbac1eaf5fb26dee748b8bd9aa3a71adb53b4c83453bc39adf52fa"},"manifestDigest":{"algorithm":"sha-256","value":"35fff9b3e214b686dcdcba8ec35768303ee51651c02b6776277be26fe61ffd06"},"profileDigest":{"algorithm":"sha-256","value":"44ac90c7f4de6e5e26d8641bfb7ac68fc2cf70115987edfe6ed1fe834ec6ec2c"},"requestDigest":{"algorithm":"sha-256","value":"027dea87824cf0d1b8d20e9eefa96b9e5785dcc4cdb1365c26c8fcd4e565b03c"}},"coverage":{"assessedCriterionIds":["criterion-synthetic-claim-01","criterion-synthetic-claim-02","criterion-synthetic-claim-03"],"status":"COMPLETE","unassessedCriterionIds":[]},"economicAction":"OUT_OF_SCOPE","errors":[],"evaluator":{"evaluatorId":"evaldossier-model-judgment-fixture-adapter","keyId":"DMxP7NUQjNSMD6VwECGLzuKW5AUt6esyUelZOYN8-Zw","softwareVersion":"0.1.0"},"ignoredInputs":[{"pointer":"/response/scoring/quality_score","reason":"Synthetic aggregate score is retained but is not used to establish a predicate."},{"pointer":"/response/scoring/confidence_score","reason":"Synthetic aggregate confidence is retained but is not a calibrated probability."},{"pointer":"/response/scoring/missing_evidence_flags","reason":"Synthetic diagnostic prose is not a formal predicate result."},{"pointer":"/response/scoring/contradiction_flags","reason":"Synthetic diagnostic prose is not a formal predicate result."},{"pointer":"/response/scoring/payout_recommendation","reason":"Synthetic payout language is source data only and never crosses the economic boundary."},{"pointer":"/response/scoring/payout_tier","reason":"Synthetic payout tier is source data only and never crosses the economic boundary."}],"issuedAt":"2026-07-21T12:10:02Z","limitations":["The adapter signature commits to normalization of project-authored synthetic bytes; it proves neither factual truth nor external execution.","No evidence was supplied, so every MODEL_JUDGMENT predicate remains UNDETERMINED.","Confidence values are synthetic, unverified, and uncalibrated.","Coverage COMPLETE refers only to the 3 synthetic claim criteria.","The fixture makes no claim about any external provider, integration, production event, adoption, or demand."],"mode":"UPSTREAM_NORMALIZATION","obligationVerdict":"INCONCLUSIVE","overallAssessment":{"assessment":"AFFIRMED","basis":"MODEL_JUDGMENT","reasonCode":"UPSTREAM_OVERALL_PASS","upstreamMapping":{"mappingPolicyId":"synthetic-model-judgment-mapping-v0","nativePointer":"/response/scoring/result","nativeValue":"pass","sourceArtifactId":"synthetic-model-response"}},"proof":{"jws":"eyJhbGciOiJFZERTQSIsImtpZCI6IkRNeFA3TlVRak5TTUQ2VndFQ0dMenVLVzVBVXQ2ZXN5VWVsWk9ZTjgtWnciLCJ0eXAiOiJldmFsZG9zc2llci5ldmFsdWF0aW9uLWF0dGVzdGF0aW9uLzAuMSJ9..Ie2L3P5xggq9q-sCHZRqntPkvqzAL81gS3P4V4GPAxmTyEIPVMlxuUALeyYEhgzqN3WzfapZyuVfSYRBZL2XDA","type":"evaldossier.detached-jws/0.1"},"protocolVersion":"evaldossier/0.1","schemaVersion":"evaldossier.evaluation-attestation/0.1","signatureContext":{"audience":"evaldossier-offline-demo","nonce":"model-judgment-attestation-nonce-0001"}}